"Department=[Amazon.com]","Search Term=[cooler]","Enter ASINs or Products=[igloo]","Reporting Range=[Weekly]","Viewing=[5/23/21 - 5/29/21]"
"Department","Search Term","Search Frequency Rank","#1 Clicked ASIN","#1 Product Title","#1 Click Share","#1 Conversion Share","#2 Clicked ASIN","#2 Product Title","#2 Click Share","#2 Conversion Share","#3 Clicked ASIN","#3 Product Title","#3 Click Share","#3 Conversion Share"
"Amazon.com","cooler",169,"B0000DH4LT","Coleman Performance Cooler, 48-Quart - Blue","9.09%","10.49%","B000W4RV6K","Coleman FlipLid Cooler, 5 Quart , Red","7.43%","10.49%","B08B6GD13W","Igloo BMX 25 Quart Cooler with Cool Riser Technology, Fish Ruler, and Tie-Down Points - 11.29 Pounds - Sandstone and Red","5.32%","4.40%"
"Amazon.com","igloo cooler","1,365","B077Y5W8YV","Igloo BMX 52 Quart Cooler with Cool Riser Technology, Fish Ruler, and Tie-Down Points - 16.34 Pounds - Carbonite Gray and Blue","24.85%","24.40%","B078WH1S6H","Igloo Trailmate Journey 70 Qt Cooler, Canyon Brown/Riverbed Tan (00034298)","5.60%","2.22%","B092RJ735C","Igloo The Boss","5.35%","6.65%"
"Amazon.com","cooler with wheels","1,873","B019N9WQAK","Coleman 62-Quart Xtreme 5-Day Heavy-Duty Cooler with Wheels, Blue/White","10.93%","16.17%","B07TXZSB9X","Coleman 50-Quart Xtreme 5-Day Heavy-Duty Cooler with Wheels, Black","9.49%","11.23%","B002VQ9PU2","Igloo Ice Cube 60 Quart Roller Cooler , Ocean Blue","5.98%","11.08%"
"Amazon.com","small cooler","5,664","B000W4RV6K","Coleman FlipLid Cooler, 5 Quart , Red","32.57%","37.37%","B07QGV6X3B","Leakproof Reusable Insulated Cooler Lunch Bag - Office Work Picnic Hiking Beach Lunch Box Organizer with Adjustable Shoulder Strap for Women,Men-Grey","8.84%","12.31%","B08B6GPZFX","Igloo BMX 25 Quart Cooler with Cool Riser Technology, Fish Ruler, and Tie-Down Points - 11.29 Pounds - Aquamarine and Gray","6.33%","1.91%"
"Amazon.com","ice pack for cooler","10,895","B0773FVRZY","Cooler Shock Reusable Ice Packs (Set of 4) - Long Lasting Cold Freezer Packs for Large Coolers & Lunch Bags - Compress for Knee Injuries, Back Pain Relief, Post-Surgery Accessories","15.65%","15.96%","B01M06AQLF","Ice Pack for Lunch Box - Freezer Packs - Original Cool Pack | Slim & Long-Lasting Ice Packs for your Lunch or Cooler Bag (Set of 4)","15.62%","19.18%","B08G2TY698","Igloo Maxcold Ice Block","7.29%","6.69%"
"Amazon.com","igloo cooler with wheels","12,683","B002VQ9PU2","Igloo Ice Cube 60 Quart Roller Cooler , Ocean Blue","19.59%","45.45%","B078WH1S6H","Igloo Trailmate Journey 70 Qt Cooler, Canyon Brown/Riverbed Tan (00034298)","14.19%","11.11%","B08RLVKB7H","Igloo MaxCold 90qt Wheeled Roller, ash Gray","9.16%","7.07%"
"Amazon.com","rolling cooler","13,347","B002VQ9PU2","Igloo Ice Cube 60 Quart Roller Cooler , Ocean Blue","10.83%","15.33%","B07GDXXWK3","dbest products Ultra Compact Cooler Smart Cart, Moroccan Tile Insulated Collapsible Rolling Tailgate BBQ Beach Summer","10.33%","19.71%","B07TXZSB9X","Coleman 50-Quart Xtreme 5-Day Heavy-Duty Cooler with Wheels, Black","9.20%","5.11%"
"Amazon.com","cooler with wheels and handle","14,814","B002VQ9PU2","Igloo Ice Cube 60 Quart Roller Cooler , Ocean Blue","9.69%","12.20%","B01LZ88201","Coleman Xtreme 50-Quart Wheeled Cooler (Dark Blue)","7.12%","8.54%","B07TXZSB9X","Coleman 50-Quart Xtreme 5-Day Heavy-Duty Cooler with Wheels, Black","6.67%","7.32%"
"Amazon.com","mini cooler","22,163","B000W4RV6K","Coleman FlipLid Cooler, 5 Quart , Red","36.56%","46.21%","B07QGV6X3B","Leakproof Reusable Insulated Cooler Lunch Bag - Office Work Picnic Hiking Beach Lunch Box Organizer with Adjustable Shoulder Strap for Women,Men-Grey","8.00%","11.36%","B000R1PE30","Igloo Mini Playmate Cooler , Red/White, 4 Qt","6.92%","3.79%"
"Amazon.com","large cooler","25,975","B08W3RKRKV","Igloo Polar Cooler Family","28.81%","29.41%","B004QILD6W","Igloo Polar 120 Qt. Cooler","14.34%","17.65%","B00AU6GB2K","Coleman Xtreme 5 Cooler | 70 Quart Day Cooler | Hard Cooler Keeps Ice Up to 5 Days, Black","6.16%","9.80%"
"Amazon.com","igloo cooler replacement parts","29,842","B008BXOKHW","Igloo Set of 2 Cooler Latch Posts & Screws (Part #24013)","13.73%","16.30%","B07YLFS3WB","NeverBreak Igloo Cooler Replacement Hinge & Latch Set | High Strength Igloo Replacement Parts | Set of 3 Cooler Hinges and 2 Cooler Latches","12.55%","14.40%","B0006FQJPY","Igloo Replacement Threaded Drain Plug","8.76%","6.25%"
"Amazon.com","hard cooler","30,017","B083XZG5P8","REYLEO Cooler, Rotomolded Cooler 21-Quart, 30-Can, 3-Day Ice Retention, Heavy Duty Ice Chest, Built-in Bottle Opener, Cup Holder, Fishing Ruler, Drain Plug - Green","11.91%","2.13%","B01N1V35UI","Igloo Profile 16 Quart Cooler","9.92%","10.64%","B077Y84VR9","Igloo BMX 25 Quart Cooler with Cool Riser Technology, Fish Ruler, and Tie-Down Points - 11.29 Pounds - Carbonite Gray and Blue","8.03%","6.38%"
"Amazon.com","camping cooler","31,607","B00AU6GB2K","Coleman Xtreme 5 Cooler | 70 Quart Day Cooler | Hard Cooler Keeps Ice Up to 5 Days, Black","15.90%","12.77%","B077Y5W8YV","Igloo BMX 52 Quart Cooler with Cool Riser Technology, Fish Ruler, and Tie-Down Points - 16.34 Pounds - Carbonite Gray and Blue","10.36%","4.26%","B0000DH4LT","Coleman Performance Cooler, 48-Quart - Blue","9.00%","14.89%"
"Amazon.com","beach cooler with wheels","31,649","B07H43SHHR","Arctic Zone Titan Deep Freeze 60 Can Rolling Cooler with All Terrain Cart, Moss, Titan 60 Can Rolling Cooler","12.38%","28.85%","B00BYDG3BM","Coleman Portable Cooler with Wheels | Xtreme Wheeled Cooler, 50-Quart","6.14%","5.77%","B01EAJJDY0","Igloo Trailmate Journey 70 Qt Cooler , Charcoal/Acid Green/Chrome","6.14%","0.00%"
"Amazon.com","plug in cooler","38,652","B08CX45PKD","Ivation Electric Cooler & Warmer with Handle |27 Quart (25 L) Portable Thermoelectric Fridge For vehicles & Trucks| 110V AC Home Power Cord & 12V Car Adapter for Camping, Travel & Picnics","20.54%","25.81%","B007ZYH4BM","Igloo 28 Quart Iceless Thermoelectric 12 Volt Portable Ice Chest Beverage Cooler, Silver","15.14%","19.35%","B08CWPX8JL","Ivation Electric Cooler & Warmer with Wheels & Handle |48 Quart (45 L) Portable Thermoelectric Fridge For vehicles & Trucks| 110V AC Home Power Cord & 12V Car Adapter for Camping, Travel & Picnics","10.05%","12.90%"
"Amazon.com","12 volt cooler","40,385","B07CSSM2HV","Wagan EL6206 - 6 Quart 12V Portable Electric Cooler/Warmer for Car, Truck, SUV, RV, Trailer DC Powered","16.34%","9.09%","B007ZYH4BM","Igloo 28 Quart Iceless Thermoelectric 12 Volt Portable Ice Chest Beverage Cooler, Silver","15.98%","9.09%","B0001MQ7E0","Koolatron Kool Kaddy P75 Thermoelectric Iceless 12V Cooler Warmer, 34L / 36 Quart Capacity, For Camping, Travel, Truck, SUV, Car, Boat, RV, Trailer, Tailgating, Made in North America","9.69%","22.73%"
"Amazon.com","wheeled cooler","40,594","B00BYDG3BM","Coleman Portable Cooler with Wheels | Xtreme Wheeled Cooler, 50-Quart","10.06%","2.63%","B004XUNDX4","Igloo 110 Qt Glide Pro Portable Large Ice Chest Wheeled Cooler, White","7.03%","7.89%","B07H43SHHR","Arctic Zone Titan Deep Freeze 60 Can Rolling Cooler with All Terrain Cart, Moss, Titan 60 Can Rolling Cooler","5.82%","0.00%"
"Amazon.com","drink cooler","48,223","B093TLPK6J","Reduce Can Cooler – 4-in-1 Stainless Steel Can Holder and Beer Bottle Holder, 4 Hours Cold – The Drink Cooler For 12 oz Slim Cans, Regular Cans, Bottles and Mixed Drinks – Nightfall, Powdercoat","9.38%","11.76%","B07R6K857M","Igloo 5-Gallon Heavy-Duty Beverage Cooler, Orange & Ultimate Drip Catcher Set (2 Set, 5-Gallon, Orange)","8.33%","5.88%","B0083H1INK","NewAir Beverage Refrigerator Cooler with 126 Can Capacity - Mini Bar Beer Fridge with Right Hinge Glass Door - Cools to 34F - AB-1200 - Stainless Steel","6.77%","11.76%"
"Amazon.com","lunch cooler for men work","57,533","B07H463Q6Y","Arctic Zone Titan Deep Freeze 16 Can Zipperless Hardbody Cooler, Moss","16.22%","9.52%","B08L9TZZQL","Arctic Zone Titan Deep Freeze 9 Can Zipperless HardBody Cooler, Process Blue (5-99090-30-0E)","10.59%","13.10%","B092RJ735C","Igloo The Boss","10.05%","4.76%"
"Amazon.com","best rolling cooler","57,754","B07TXZSB9X","Coleman 50-Quart Xtreme 5-Day Heavy-Duty Cooler with Wheels, Black","10.55%","6.25%","B002VQ9PU2","Igloo Ice Cube 60 Quart Roller Cooler , Ocean Blue","9.23%","25.00%","B004XUNDX4","Igloo 110 Qt Glide Pro Portable Large Ice Chest Wheeled Cooler, White","7.25%","0.00%"
"Amazon.com","retro cooler","59,560","B083P48GP6","Igloo Special Edition 25 Quart Retro Full Sized Picnic Basket Hard Side Insulated Cooler with Molded in Side Handles, Multicolor","42.47%","56.25%","B08JL95MYN","Igloo 90s Retro Collection Portable Square Neon Lunch Box Soft Side Cooler with Carry Handle and Adjustable Strap, Multicolored","14.46%","12.50%","B08LJH82K9","Igloo Quart Limited Edition Portable Lunchbox Playmate Pal Cooler Ice Box","5.87%","12.50%"
"Amazon.com","12v cooler","62,126","B007ZYH4BM","Igloo 28 Quart Iceless Thermoelectric 12 Volt Portable Ice Chest Beverage Cooler, Silver","16.67%","6.25%","B00NHBYOA6","Wagan 12V Cooler/Warmer - 24L Capacity (6224) -EL6224","15.43%","6.25%","B07CSSM2HV","Wagan EL6206 - 6 Quart 12V Portable Electric Cooler/Warmer for Car, Truck, SUV, RV, Trailer DC Powered","13.12%","18.75%"
"Amazon.com","playmate cooler","66,846","B092RJ735C","Igloo The Boss","27.20%","31.51%","B089NJB3NY","Igloo Playmate","22.40%","23.29%","B000R1PE30","Igloo Mini Playmate Cooler , Red/White, 4 Qt","16.34%","12.33%"
"Amazon.com","electric cooler","72,813","B007ZYH4BM","Igloo 28 Quart Iceless Thermoelectric 12 Volt Portable Ice Chest Beverage Cooler, Silver","24.21%","25.00%","B08CWPX8JL","Ivation Electric Cooler & Warmer with Wheels & Handle |48 Quart (45 L) Portable Thermoelectric Fridge For vehicles & Trucks| 110V AC Home Power Cord & 12V Car Adapter for Camping, Travel & Picnics","13.68%","0.00%","B07F8XVHH1","K-Box Electric Cooler and Warmer for Car and Home - 34 Quart (32 Liter) - Dual 110V AC House and 12V DC Vehicle Plugs (Blue)","10.53%","0.00%"
"Amazon.com","cooler wheels","78,992","B06Y1PWF5V","Cooler Wheel Kit with 10 Pneumatic Rubber Tires for YETI, RTIC & Kong Coolers","11.99%","7.69%","B002VQ9PU2","Igloo Ice Cube 60 Quart Roller Cooler , Ocean Blue","9.95%","23.08%","B019N9WQAK","Coleman 62-Quart Xtreme 5-Day Heavy-Duty Cooler with Wheels, Blue/White","9.69%","30.77%"
"Amazon.com","igloo water cooler","83,359","B08WFYFHCN","Igloo Heavy-Duty Seat Top Water Dispenser","16.24%","27.03%","B078SS4T9P","Igloo Proformance 1 Quart Water Jug, Orange/Black","9.64%","5.41%","B0088AYPOG","Igloo 2-Gallon Sport Beverage Cooler, Majestic Blue, Model Number: 31377","8.12%","8.11%"
"Amazon.com","fishing cooler","84,239","B07W3TYXGM","AIEVE Fishing Rod Holder, Fishing Pole Holder Fishing Rod Rack Stand Attachment Rod Holders for Boat, Cooler Fishing Rod Holder for YETI Coolers and RTIC Coolers with Tie-Down Slot Cooler Accessories","21.71%","16.67%","B08W3RKRKV","Igloo Polar Cooler Family","7.57%","0.00%","B00MQ1QY92","Engel Cooler/Dry Box with 4 Rod Holders - 30 Qt - Tan (UC30T-RH)","6.25%","0.00%"
"Amazon.com","metal cooler","87,483","B0009PURKE","Coleman Cooler | Steel-Belted Cooler Keeps Ice Up to 4 Days | 54-Quart Cooler for Camping, Barbecues, Tailgating & Outdoor Activities","18.09%","20.00%","B0009PURKO","Coleman Cooler | Steel-Belted Cooler Keeps Ice Up to 4 Days | 54-Quart Cooler for Camping, BBQs, Tailgating & Outdoor Activities","18.09%","20.00%","B007WXPZCQ","Igloo Stainless Steel 54 Quart Cooler","15.76%","20.00%"
"Amazon.com","5 gallon water cooler","87,832","B00H5L3L6W","Rubbermaid Commercial 5-Gallon Water Cooler","14.21%","24.44%","B08WFYFHCN","Igloo Heavy-Duty Seat Top Water Dispenser","12.97%","11.11%","B07R6K857M","Igloo 5-Gallon Heavy-Duty Beverage Cooler, Orange & Ultimate Drip Catcher Set (2 Set, 5-Gallon, Orange)","12.22%","22.22%"
"Amazon.com","boat cooler","88,537","B0088AYDYS","Igloo 36 Quart Marine Ultra Cooler, White","13.22%","12.50%","B07H49BT3H","Arctic Zone Titan Deep Freeze 30 Can Zipperless HardBody Cooler, Moss (1718IL918763)","8.81%","0.00%","B08W3RKRKV","Igloo Polar Cooler Family","7.80%","12.50%"
"Amazon.com","marine cooler","91,067","B08W3RKRKV","Igloo Polar Cooler Family","15.48%","9.09%","B0088AYDYS","Igloo 36 Quart Marine Ultra Cooler, White","11.01%","0.00%","B077Y5W8YV","Igloo BMX 52 Quart Cooler with Cool Riser Technology, Fish Ruler, and Tie-Down Points - 16.34 Pounds - Carbonite Gray and Blue","7.44%","0.00%"
"Amazon.com","igloo retro cooler","92,330","B083P48GP6","Igloo Special Edition 25 Quart Retro Full Sized Picnic Basket Hard Side Insulated Cooler with Molded in Side Handles, Multicolor","57.40%","56.00%","B08JL95MYN","Igloo 90s Retro Collection Portable Square Neon Lunch Box Soft Side Cooler with Carry Handle and Adjustable Strap, Multicolored","11.88%","20.00%","B08YPCF95D","Igloo Special Edition Retro 2 Gallon Barrel of Fun Cooler Jug with Drip Resistant Spigot and Swing Up Bail Handle, Multicolor","5.48%","8.00%"
"Amazon.com","insulated cooler","94,321","B07G9QSYQK","Igloo BMX 25 Quart Cooler with Cool Riser Technology, White","16.83%","0.00%","B07KC1R73B","Lifewit Collapsible Cooler Bag 32-Can Insulated Leakproof Soft Cooler Portable Double Decker Cooler Tote for Trip/Picnic/Sports/Flight, Grey","9.90%","19.05%","B08CVQ14LS","GARDRIT 60 Can Large Cooler Bag - Collapsible Insulated Lunch Box, Leakproof Cooler Bag Suitable for Camping, Picnic& Beach (39L/Grey)","8.42%","14.29%"
"Amazon.com","big cooler","103,689","B08W3RKRKV","Igloo Polar Cooler Family","22.95%","25.00%","B004QILD6W","Igloo Polar 120 Qt. Cooler","15.03%","25.00%","B00165UHI8","Coleman 3000001526 150Qt Marine Cooler, White","9.84%","12.50%"
"Amazon.com","thermoelectric cooler","104,573","B01IT8SAZG","GeeBat 10PCS TEC1-12706 Thermoelectric Cooler Heat Sink Heatsink Cooling Peltier 12V 5.8A","15.87%","7.69%","B07YV3JQSL","ESUMIC DC 12V DIY Thermoelectric Peltier Refrigeration Cooling System Kit Semiconductor Cooler Conduction Module + Radiator + Fan + TEC1-12706","15.87%","7.69%","B007ZYH4BM","Igloo 28 Quart Iceless Thermoelectric 12 Volt Portable Ice Chest Beverage Cooler, Silver","12.92%","23.08%"
"Amazon.com","igloo cooler bag","107,343","B08JHJYJ1K","Igloo Repreve Recycled Performance Fiber 16 Can Avery Soft Side Cooler Tote Bag with Shoulder Straps and Exterior Pocket, Cherry","20.16%","18.18%","B089X24VN7","Igloo 00064576 Coast Cooler 36 Seadrift Gray, Black","18.99%","9.09%","B08JLFTCKN","Igloo Repreve 14 Can Portable Insulated Recycled Outdoor Lake Work Food Drink Soft Sided Cooler Lunch Pail Bag with Strap, Cherry","7.75%","18.18%"
"Amazon.com","ice cooler with wheels","107,396","B002VQ9PU2","Igloo Ice Cube 60 Quart Roller Cooler , Ocean Blue","19.38%","42.86%","B019N9WQAK","Coleman 62-Quart Xtreme 5-Day Heavy-Duty Cooler with Wheels, Blue/White","16.96%","14.29%","B07TXZSB9X","Coleman 50-Quart Xtreme 5-Day Heavy-Duty Cooler with Wheels, Black","9.34%","14.29%"
"Amazon.com","igloo trailmate cooler","109,804","B078WH1S6H","Igloo Trailmate Journey 70 Qt Cooler, Canyon Brown/Riverbed Tan (00034298)","47.45%","43.75%","B071JPY74V","Igloo 34231 Trailmate Marine Wheeled Cooler, 70 Quart, White/Black/White/Chrome","26.34%","18.75%","B083SRDN3J","Igloo 00034492 Trailmate Marine White, Grey, Grey, Grey","10.76%","18.75%"
"Amazon.com","cooler ice pack","116,623","B01M06AQLF","Ice Pack for Lunch Box - Freezer Packs - Original Cool Pack | Slim & Long-Lasting Ice Packs for your Lunch or Cooler Bag (Set of 4)","17.26%","23.91%","B0773FVRZY","Cooler Shock Reusable Ice Packs (Set of 4) - Long Lasting Cold Freezer Packs for Large Coolers & Lunch Bags - Compress for Knee Injuries, Back Pain Relief, Post-Surgery Accessories","15.04%","8.70%","B08G2TY698","Igloo Maxcold Ice Block","10.18%","8.70%"
"Amazon.com","cooler accessories","118,291","B08MJ8TVFB","Cooler Net for Dry Storage + Organization | Compatible with Yeti, Coleman, Igloo, Pelican, Canyon, Grizzly, Lifetime Ice Chests | Strong Camping Accessory, Trimmable for Custom Fit | Boating Equipment","25.91%","33.33%","B001N7FIVU","Coghlan's Inside Cooler Lid Light","15.38%","16.67%","B08ZXKCBTS","Cooler Net for Dry Storage + Organization | Compatible with Yeti Tundra Haul, Yeti 45, RTIC 45, Coleman 54, Lifetime Ice Chests | Strong Camping Accessory, Trimmable for Custom Fit | Boating Equipment","13.77%","33.33%"
"Amazon.com","large cooler with wheels","129,037","B000G64FJK","Coleman 100 Quart Xtreme 5 Wheeled Cooler","21.41%","36.00%","B004XUNDX4","Igloo 110 Qt Glide Pro Portable Large Ice Chest Wheeled Cooler, White","18.85%","32.00%","B08W3RKRKV","Igloo Polar Cooler Family","14.06%","4.00%"
"Amazon.com","150 qt cooler","145,589","B08W3RKRKV","Igloo Polar Cooler Family","21.86%","5.26%","B07X8RB8QL","Coleman Ice Chest | 150 Quart Hard Cooler, Rock Gray","13.83%","26.32%","B004QILD6W","Igloo Polar 120 Qt. Cooler","12.22%","21.05%"
"Amazon.com","igloo cooler backpack","153,456","B082XMKVM2","Igloo 00064580 Switch Backpack Seadrift White, Gray","32.33%","11.11%","B07W8WSCNF","Igloo 00064624 Gizmo Backpack Outdoorsman Black","13.36%","0.00%","B082XN5JJJ","Igloo 00064626 Gizmo Backpack Outdoorsman Navy","13.36%","11.11%"
"Amazon.com","20 qt cooler","156,193","B083XZG5P8","REYLEO Cooler, Rotomolded Cooler 21-Quart, 30-Can, 3-Day Ice Retention, Heavy Duty Ice Chest, Built-in Bottle Opener, Cup Holder, Fishing Ruler, Drain Plug - Green","23.58%","14.29%","B077Y84VR9","Igloo BMX 25 Quart Cooler with Cool Riser Technology, Fish Ruler, and Tie-Down Points - 11.29 Pounds - Carbonite Gray and Blue","14.62%","28.57%","B089ZGWFX9","AmazonCommercial Rotomolded Cooler, 20 Quart, White","11.32%","14.29%"
"Amazon.com","magellan cooler","156,569","B083XZG5P8","REYLEO Cooler, Rotomolded Cooler 21-Quart, 30-Can, 3-Day Ice Retention, Heavy Duty Ice Chest, Built-in Bottle Opener, Cup Holder, Fishing Ruler, Drain Plug - Green","37.68%","100.00%","B077Y5W8YV","Igloo BMX 52 Quart Cooler with Cool Riser Technology, Fish Ruler, and Tie-Down Points - 16.34 Pounds - Carbonite Gray and Blue","12.32%","0.00%","B07R1CY27J","Arctic Zone Titan Deep Freeze 20Q Premium Ice Chest Roto Cooler with Microban Protection, Blue","8.70%","0.00%"
"Amazon.com","cooler igloo","157,370","B077Y5W8YV","Igloo BMX 52 Quart Cooler with Cool Riser Technology, Fish Ruler, and Tie-Down Points - 16.34 Pounds - Carbonite Gray and Blue","25.38%","55.56%","B01N1V35UI","Igloo Profile 16 Quart Cooler","11.68%","0.00%","B089NJB3NY","Igloo Playmate","9.64%","0.00%"
"Amazon.com","best ice chest cooler","160,172","B077Y5W8YV","Igloo BMX 52 Quart Cooler with Cool Riser Technology, Fish Ruler, and Tie-Down Points - 16.34 Pounds - Carbonite Gray and Blue","16.79%","0.00%","B08W3RKRKV","Igloo Polar Cooler Family","14.60%","50.00%","B0000DH4LT","Coleman Performance Cooler, 48-Quart - Blue","12.41%","0.00%"
"Amazon.com","igloo marine cooler","163,140","B006MIXISA","Igloo Marine Ultra Cooler (White, 72-Quart)","19.12%","22.22%","B01NAM1TNA","Igloo 25 Quart Marine Contour, White","10.29%","22.22%","B000CEOXG6","Igloo Marine 94 Quart Cooler","8.33%","0.00%"
"Amazon.com","igloo soft cooler","163,278","B08G5BTGYZ","Igloo Reactor Portable 30 Can Soft Sided Insulated Leakproof Waterproof Zipper Cooler Bag with Shoulder Strap for Hiking, Camping, Fishing, & Picnic, Gray Asphalt","14.84%","0.00%","B082XMGVML","Igloo 00064574 Coast Cooler 36 Seadrift White, Gray","11.54%","0.00%","B08G58R616","Igloo Reactor Portable 18 Can Soft Sided Insulated Leakproof Waterproof Zipper Cooler Bag with Shoulder Strap for Hiking, Camping, Fishing, & Picnic, Gray Asphalt","10.44%","0.00%"
"Amazon.com","small hard cooler","166,081","B000W4RV6K","Coleman FlipLid Cooler, 5 Quart , Red","33.19%","36.36%","B01N1V35UI","Igloo Profile 16 Quart Cooler","9.36%","30.30%","B077Y84VR9","Igloo BMX 25 Quart Cooler with Cool Riser Technology, Fish Ruler, and Tie-Down Points - 11.29 Pounds - Carbonite Gray and Blue","9.36%","0.00%"
"Amazon.com","solar powered cooler","175,961","B08J8D1XCC","Mobicool MT35W Thermoelectric Cooler - 34l Capacity, Holds 48 cans","37.61%","0.00%","B07NMHHKRR","LiONCooler X40A Fridge and Freezer with Solar/AC/Car Rechargeable Battery","34.40%","0.00%","B00DVRKH4I","Igloo Iceless 40 Qt Thermoelectric Cooler, Grey, Model Number: 00040374","5.50%","0.00%"
"Amazon.com","gatorade cooler","179,898","B01G96KFZ8","Gatorade Half gallon Cooler","17.33%","5.26%","B095KZ5MZV","Igloo 5 Gallon Portable Sports Cooler Water Beverage Dispenser with Flat Seat Lid, Bright Orange","17.33%","21.05%","B007IBI5XI","Gatorade 49201-09 Cooler with Cup Dispenser, 5 gal Capacity, Orange, Standard","15.84%","15.79%"
"Amazon.com","cooler light","185,108","B001N7FIVU","Coghlan's Inside Cooler Lid Light","48.76%","65.38%","B08TTWLZ48","HEXNUB Cooler Box Light, Waterproof, Rechargeable LED Light for Ice Chest, Nighttime Illumination, No Mounting Required, Magnetic Base, Great for Outdoor Events, Camping, Fishing, Hunting, Boating","11.31%","11.54%","B08TMG1ZCN","SIRUITON 2 Pack LED Cooler Light - Light for Nighttime of Your Yeti, ORCA, RTIC, Igloo ， with 30 lamp beadsReusable Battery Powered Bright Colored Lights for Camping, Tailgating, and Parties","10.25%","3.85%"
"Amazon.com","extra large cooler","189,526","B08W3RKRKV","Igloo Polar Cooler Family","32.04%","58.33%","B00165UHI8","Coleman 3000001526 150Qt Marine Cooler, White","14.56%","0.00%","B004QILD6W","Igloo Polar 120 Qt. Cooler","13.59%","16.67%"
"Amazon.com","bear proof cooler","201,013","B077Y5W8YV","Igloo BMX 52 Quart Cooler with Cool Riser Technology, Fish Ruler, and Tie-Down Points - 16.34 Pounds - Carbonite Gray and Blue","48.04%","50.00%","B077TTYW8M","Lifetime 90820 55 Quart High Performance Cooler, Grey","8.94%","25.00%","B08YY7CBN1","Cascade Mountain Tech Rotomolded Cooler - Heavy Duty for Camping, Fishing, Tailgating, Barbeques, and Outdoor Activities","8.94%","0.00%"
"Amazon.com","hard sided cooler","201,495","B083XZG5P8","REYLEO Cooler, Rotomolded Cooler 21-Quart, 30-Can, 3-Day Ice Retention, Heavy Duty Ice Chest, Built-in Bottle Opener, Cup Holder, Fishing Ruler, Drain Plug - Green","26.79%","0.00%","B077Y84VR9","Igloo BMX 25 Quart Cooler with Cool Riser Technology, Fish Ruler, and Tie-Down Points - 11.29 Pounds - Carbonite Gray and Blue","14.29%","0.00%","B07R1CY27J","Arctic Zone Titan Deep Freeze 20Q Premium Ice Chest Roto Cooler with Microban Protection, Blue","13.39%","0.00%"
"Amazon.com","small igloo cooler","201,580","B000R1PE30","Igloo Mini Playmate Cooler , Red/White, 4 Qt","26.51%","35.71%","B092RJ735C","Igloo The Boss","13.25%","21.43%","B000BOB5L8","Igloo Cooler, Legend 12, Red, 9 Quart","12.05%","14.29%"
"Amazon.com","5 day cooler","202,039","B00AU6GB2K","Coleman Xtreme 5 Cooler | 70 Quart Day Cooler | Hard Cooler Keeps Ice Up to 5 Days, Black","30.34%","33.33%","B077Y5W8YV","Igloo BMX 52 Quart Cooler with Cool Riser Technology, Fish Ruler, and Tie-Down Points - 16.34 Pounds - Carbonite Gray and Blue","14.61%","25.00%","B07G9QSYQK","Igloo BMX 25 Quart Cooler with Cool Riser Technology, White","7.87%","0.00%"
"Amazon.com","plug in cooler for car","209,135","B07CSSM2HV","Wagan EL6206 - 6 Quart 12V Portable Electric Cooler/Warmer for Car, Truck, SUV, RV, Trailer DC Powered","23.44%","16.67%","B08CX45PKD","Ivation Electric Cooler & Warmer with Handle |27 Quart (25 L) Portable Thermoelectric Fridge For vehicles & Trucks| 110V AC Home Power Cord & 12V Car Adapter for Camping, Travel & Picnics","22.40%","33.33%","B007ZYH4BM","Igloo 28 Quart Iceless Thermoelectric 12 Volt Portable Ice Chest Beverage Cooler, Silver","18.75%","8.33%"
"Amazon.com","30 qt cooler","209,490","B07G9QSYQK","Igloo BMX 25 Quart Cooler with Cool Riser Technology, White","15.43%","20.00%","B004GN8KGI","Igloo 30 Quart Contour Cooler , blue","12.96%","40.00%","B008953C1M","Igloo Marine Ultra Coolers, White, 30 Qt","12.96%","20.00%"
"Amazon.com","igloo cooler hinges replacement","210,048","B008EWTAMK","Igloo Cooler Plastic Hinges for Ice Chests (Set of 3)","19.23%","19.70%","B0741D69C1","Igloo Cooler Stainless Steel Hinges for Ice Chests (Set of 3)","17.31%","21.21%","B07L2KGTVN","NeverBreak Igloo Cooler Replacement Hinges | High Strength Hinges for Igloo Cooler | Set of 3 Cooler Hinges","13.46%","13.64%"
"Amazon.com","120 qt cooler","217,321","B08W3RKRKV","Igloo Polar Cooler Family","32.37%","26.09%","B00I15BDPW","Coleman Company 120-Quart Cooler, Blue","13.29%","26.09%","B004QILD6W","Igloo Polar 120 Qt. Cooler","12.14%","13.04%"
"Amazon.com","stainless steel cooler","219,423","B007WXPZCQ","Igloo Stainless Steel 54 Quart Cooler","29.45%","12.50%","B07QP16N5Y","Margaritaville 54 Quart Stainless Steel Portable Cooler with Bottle Opener - Margaritaville Chill","18.49%","25.00%","B0842BVBPP","YETI V Series 55, Stainless Steel Vacuum Insulated Hard Cooler","16.44%","0.00%"
"Amazon.com","electric cooler for car and home","223,048","B08CX45PKD","Ivation Electric Cooler & Warmer with Handle |27 Quart (25 L) Portable Thermoelectric Fridge For vehicles & Trucks| 110V AC Home Power Cord & 12V Car Adapter for Camping, Travel & Picnics","20.45%","30.00%","B08CWPX8JL","Ivation Electric Cooler & Warmer with Wheels & Handle |48 Quart (45 L) Portable Thermoelectric Fridge For vehicles & Trucks| 110V AC Home Power Cord & 12V Car Adapter for Camping, Travel & Picnics","16.67%","40.00%","B007ZYH4BM","Igloo 28 Quart Iceless Thermoelectric 12 Volt Portable Ice Chest Beverage Cooler, Silver","10.61%","10.00%"
"Amazon.com","roller cooler","224,276","B07H43SHHR","Arctic Zone Titan Deep Freeze 60 Can Rolling Cooler with All Terrain Cart, Moss, Titan 60 Can Rolling Cooler","16.80%","16.67%","B002VQ9PU2","Igloo Ice Cube 60 Quart Roller Cooler , Ocean Blue","14.40%","0.00%","B07GDXXWK3","dbest products Ultra Compact Cooler Smart Cart, Moroccan Tile Insulated Collapsible Rolling Tailgate BBQ Beach Summer","11.20%","0.00%"
